英語,日本語,品詞,例文英語１,例文日本語１,例文英語2,例文日本語2,例文英語3,例文日本語3,例文英語4,例文日本語4,last_learned_date,mistake_count,correct_count
therapy,"治療,療法",名詞,She is undergoing physical therapy for her knee injury.,彼女は膝の怪我のために理学療法を受けている。,Art therapy can be beneficial for emotional expression.,アートセラピーは感情表現に役立つことがある。,He found therapy helpful in dealing with his anxiety.,彼は不安に対処するためにセラピーが役立つと感じた。,The doctor recommended speech therapy for the child.,医師はその子供に言語療法を勧めた。,,0,0
investigate,"調査する,研究する",動詞,The police are investigating the cause of the accident.,警察は事故の原因を調査している。,Scientists investigate the mysteries of the universe.,科学者たちは宇宙の謎を研究する。,The committee was formed to investigate the allegations.,その委員会は疑惑を調査するために結成された。,We need to investigate all possible solutions.,私たちは考えられるすべての解決策を調査する必要がある。,,0,0
draft,"下書き,草案",名詞,She submitted the first draft of her essay.,彼女はエッセイの初稿を提出した。,The lawyer prepared a draft of the contract.,弁護士は契約書の草案を作成した。,He was drafted into the army.,彼は軍隊に徴兵された。,Could you draft a quick email for me?,私に簡単なメールを書いてもらえますか？,,0,0
illustration,"図解,実例",名詞,The book contains many beautiful illustrations.,その本には多くの美しい挿絵が含まれている。,This case serves as a good illustration of the problem.,このケースはその問題の良い実例となる。,She provided an illustration to clarify her point.,彼女は自分の主張を明確にするために図解を提供した。,The artist specializes in children's book illustrations.,その芸術家は児童書の挿絵を専門としている。,,0,0
mayor,"市長,町長",名詞,The mayor announced a new initiative for urban development.,市長は都市開発のための新しい取り組みを発表した。,She is running for mayor in the next election.,彼女は次回の選挙で市長に立候補している。,The mayor attended the opening ceremony of the new park.,市長は新しい公園の開園式に出席した。,The mayor's office is located in the city hall.,市長室は市庁舎にある。,,0,0
dentist,"歯医者,歯科医",名詞,I have an appointment with the dentist tomorrow.,明日、歯医者の予約がある。,It's important to visit the dentist regularly for check-ups.,定期的に歯医者に行って検診を受けることが重要だ。,The dentist advised him to brush his teeth twice a day.,歯医者は彼に1日2回歯を磨くように助言した。,She wants to become a dentist when she grows up.,彼女は大人になったら歯医者になりたいと思っている。,,0,0
punishment,"罰,罰則",名詞,The punishment for the crime was severe.,その犯罪に対する罰は厳しかった。,He received a light punishment for his actions.,彼は自分の行動に対して軽い罰を受けた。,Parents often use punishment to discipline their children.,親は子供をしつけるために罰を用いることが多い。,The teacher gave him extra homework as a punishment.,先生は彼に罰として追加の宿題を与えた。,,0,0
off duty,"非番の,勤務時間外で",熟語,The police officer was off duty when the incident occurred.,事件が発生したとき、その警察官は非番だった。,She enjoys spending time with her family when she's off duty.,彼女は非番のときに家族と過ごすのを楽しんでいる。,He was off duty and wearing civilian clothes.,彼は非番で私服を着ていた。,The nurse was off duty and couldn't help.,看護師は非番で、助けることができなかった。,,0,0
discovery,"発見,見つけること",名詞,The discovery of penicillin revolutionized medicine.,ペニシリンの発見は医学に革命をもたらした。,Scientists announced a new discovery in space exploration.,科学者たちは宇宙探査における新しい発見を発表した。,The archaeological discovery shed light on ancient civilizations.,その考古学的発見は古代文明に光を当てた。,The joy of discovery is what drives many researchers.,発見の喜びが多くの研究者を突き動かすものだ。,,0,0
forever,"永遠に,ずっと",副詞,I will love you forever.,永遠にあなたを愛します。,The memory of that day will stay with me forever.,あの日の記憶は私の中にずっと残るだろう。,It felt like the journey would last forever.,旅が永遠に続くかのように感じられた。,Nothing lasts forever.,何も永遠には続かない。,,0,0
warn,"警告する,警戒する",動詞,I warned him about the dangers of driving too fast.,私は彼にスピードの出しすぎの危険について警告した。,The sign warned visitors about falling rocks.,その標識は訪問者に落石について警告していた。,She warned me not to trust him.,彼女は私に彼を信用しないように警告した。,The meteorologists warned of a severe storm.,気象学者たちは激しい嵐を警告した。,,0,0
just in case,もしもの場合に,熟語,"Take an umbrella, just in case it rains.",雨が降る場合に備えて、傘を持っていきなさい。,"I brought extra snacks, just in case we get hungry.",お腹が空く場合に備えて、余分な軽食を持ってきた。,"Write down the number, just in case you forget it.",忘れる場合に備えて、その番号を書き留めておきなさい。,"She keeps a first-aid kit in her car, just in case.",彼女は万が一に備えて、車に救急箱を常備している。,,0,0
opinion,"意見,考え",名詞,Everyone is entitled to their own opinion.,誰もが自分の意見を持つ権利がある。,What's your opinion on the new policy?,新しい政策についてどう思いますか？,He expressed his opinion freely.,彼は自由に自分の意見を述べた。,"In my opinion, it's the best solution.",私の意見では、それが最善の解決策だ。,,0,0
hesitation,"ためらい,躊躇",名詞,She answered without hesitation.,彼女はためらうことなく答えた。,There was a moment of hesitation before he spoke.,彼が話す前に一瞬の躊躇があった。,His hesitation cost him the opportunity.,彼の躊躇が機会を失わせた。,Don't show any hesitation when making a decision.,決断を下すときにためらいを見せてはいけない。,,0,0
ensure,"を確実にする,を保証する",動詞,Please ensure that all doors are locked before you leave.,出発前にすべてのドアが施錠されていることを確認してください。,This system will ensure the safety of our data.,このシステムはデータの安全性を保証する。,We need to ensure that everyone understands the instructions.,全員が指示を理解していることを確認する必要がある。,Proper planning will ensure the success of the project.,適切な計画がプロジェクトの成功を確実にするだろう。,,0,0
merely,"単に,ただ",副詞,"It was merely a suggestion, not an order.",それは単なる提案であり、命令ではない。,"He is merely a child, don't expect too much.",彼はただの子供だ、多くを期待してはいけない。,The problem is not merely financial.,問題は単に財政的なものではない。,"She smiled, merely to be polite.",彼女はただ礼儀のために微笑んだ。,,0,0
horror,"恐怖,怖さ",名詞,The horror movie kept me on the edge of my seat.,そのホラー映画は私をハラハラさせた。,She screamed in horror when she saw the spider.,彼女はクモを見て恐怖で叫んだ。,The news of the disaster filled them with horror.,その災害のニュースは彼らを恐怖で満たした。,He has a horror of public speaking.,彼は人前で話すことをひどく嫌がる。,,0,0
annoy,"いらだたせる,怒らせる",動詞,His constant complaining began to annoy me.,彼の絶え間ない不平は私をいらだたせ始めた。,Don't annoy your sister.,妹をいらだたせるな。,The buzzing sound of the mosquito annoyed him.,蚊のブンブンという音が彼をいらだたせた。,It really annoys me when people are late.,人が遅刻すると本当に腹が立つ。,,0,0
creative,"創造的な,独創的な",形容詞,She is a very creative artist.,彼女はとても創造的な芸術家だ。,We need creative solutions to this problem.,この問題には創造的な解決策が必要だ。,The company encourages its employees to be creative.,その会社は従業員に創造的であることを奨励している。,He has a creative mind and always comes up with new ideas.,彼は創造的な心の持ち主で、常に新しいアイデアを思いつく。,,0,0
commitment,"約束,委託",名詞,Marriage requires a strong commitment from both partners.,結婚には両方のパートナーからの強いコミットメントが必要だ。,The company showed its commitment to environmental protection.,その会社は環境保護へのコミットメントを示した。,He made a commitment to finish the project on time.,彼はプロジェクトを期限内に終えるという約束をした。,Her commitment to her studies is admirable.,彼女の学業への献身は称賛に値する。,,0,0
originality,"独創性,斬新さ",名詞,The judges were impressed by the originality of her design.,審査員は彼女のデザインの独創性に感銘を受けた。,His work lacks originality and creativity.,彼の作品には独創性と創造性が欠けている。,The film was praised for its originality.,その映画は斬新さで称賛された。,Originality is key in artistic expression.,芸術表現において独創性は重要だ。,,0,0
catch up with,"に追いつく,付いていく",熟語,I need to catch up with my friends after work.,仕事の後、友達と近況を報告し合う必要がある。,He ran fast to catch up with the others.,彼は他の人に追いつくために速く走った。,I'll catch up with you later.,後で追いつくよ。,The police finally caught up with the suspect.,警察はついに容疑者を捕まえた。,,0,0
financial,"財政の,財務に関する",形容詞,She has a strong background in financial management.,彼女は財務管理において強力な経歴を持っている。,The company is facing financial difficulties.,その会社は財政難に直面している。,He sought financial advice from an expert.,彼は専門家から財政的な助言を求めた。,The government provides financial aid to students.,政府は学生に財政援助を提供している。,,0,0
output,"生産量,製造量",名詞,The factory's output increased significantly this year.,今年の工場の生産量は大幅に増加した。,The computer's output was displayed on the screen.,コンピュータの出力が画面に表示された。,We need to improve the quality of our output.,私たちは生産物の品質を向上させる必要がある。,The artist's creative output is impressive.,その芸術家の創造的な作品は印象的だ。,,0,0
evaluation,"評価,査定",名詞,The performance evaluation is conducted annually.,業績評価は毎年実施される。,The project is currently under evaluation.,そのプロジェクトは現在評価中だ。,Her evaluation of the situation was accurate.,彼女の状況判断は正確だった。,We need to conduct a thorough evaluation of the risks.,私たちはリスクの徹底的な評価を行う必要がある。,,0,0
physics,"物理学,物理科学",名詞,He is studying physics at university.,彼は大学で物理学を学んでいる。,Physics is a fundamental science.,物理学は基礎科学である。,She has a strong interest in quantum physics.,彼女は量子物理学に強い関心を持っている。,The laws of physics govern the universe.,物理学の法則が宇宙を支配している。,,0,0
interfere,"に干渉する,介入する",動詞,Don't interfere in my personal life.,私の私生活に干渉しないでください。,His loud music interfered with my studies.,彼の大きな音楽が私の勉強の邪魔をした。,The government should not interfere with the free market.,政府は自由市場に干渉すべきではない。,I try not to interfere with my children's decisions.,私は子供たちの決定に干渉しないようにしている。,,0,0
whether,"どちらか,いずれか",接続詞,I don't know whether he will come or not.,彼が来るかどうか分からない。,She asked whether I was interested in the project.,彼女は私がそのプロジェクトに興味があるかどうか尋ねた。,It depends on whether you are willing to work hard.,それはあなたが一生懸命働くかどうかによる。,He couldn't decide whether to stay or go.,彼は留まるべきか去るべきか決められなかった。,,0,0
favorite,"特に好きな,お気に入りの",形容詞,What's your favorite color?,あなたの好きな色は何ですか？,My favorite food is pizza.,私のお気に入りの食べ物はピザです。,She is my favorite singer.,彼女は私のお気に入りの歌手だ。,This is one of my favorite books.,これは私のお気に入りの本の一つだ。,,0,0
debt,"借金,負債",名詞,He is struggling to pay off his debts.,彼は借金を返済するのに苦労している。,The company is heavily in debt.,その会社は多額の負債を抱えている。,She paid off her student loan debt.,彼女は学生ローンの借金を完済した。,The country's national debt is growing.,国の国家債務が増加している。,,0,0
conversation,"会話,対話",名詞,They had a long conversation about their plans.,彼らは計画について長い会話をした。,I enjoyed our conversation very much.,私たちの会話はとても楽しかった。,The conversation flowed easily between them.,彼らの間で会話はスムーズに進んだ。,He tried to start a conversation with her.,彼は彼女と会話を始めようとした。,,0,0
representative,"代表者,代理人",名詞,She is a representative of the company.,彼女はその会社の代表者だ。,Each state has two senators as its representatives.,各州には2人の上院議員が代表としてる。,He was chosen as the student representative.,彼は生徒代表に選ばれた。,The painting is representative of his early work.,その絵は彼の初期の作品を代表している。,,0,0
relation,"関係性,相互作用",名詞,The relation between diet and health is well-known.,食事と健康の関係はよく知られている。,She has a good relation with her colleagues.,彼女は同僚と良好な関係を築いている。,He is a distant relation of mine.,彼は私の遠い親戚だ。,The two events have no direct relation.,その二つの出来事には直接的な関係がない。,,0,0
pleasure,"楽しみ,喜び",名詞,It was a pleasure to meet you.,お会いできて光栄でした。,Reading brings me great pleasure.,読書は私に大きな喜びをもたらす。,He takes pleasure in helping others.,彼は他人を助けることに喜びを感じる。,The trip was a pure pleasure from start to finish.,その旅行は最初から最後まで純粋な楽しみだった。,,0,0
regional,"地方の,地域の",形容詞,The company has a strong regional presence.,その会社は地域で強い存在感を示している。,We need to consider regional differences.,私たちは地域差を考慮する必要がある。,The regional manager is responsible for sales in this area.,地域マネージャーがこの地域の販売を担当している。,They serve traditional regional dishes.,彼らは伝統的な郷土料理を提供している。,,0,0
expensive,"高価な,費用のかかる",形容詞,That car is too expensive for me.,その車は私には高すぎる。,Eating out every day can be very expensive.,毎日外食するのはとても費用がかかる。,She bought an expensive diamond necklace.,彼女は高価なダイヤモンドのネックレスを買った。,Quality products are often more expensive.,質の良い製品はしばしば高価だ。,,0,0
dust,"ほこり,塵",名詞,The old books were covered in dust.,古い本はほこりで覆われていた。,She used a cloth to wipe the dust off the furniture.,彼女は布を使って家具のほこりを拭き取った。,A cloud of dust rose from the dry road.,乾いた道からほこりの雲が舞い上がった。,The room was full of dust and cobwebs.,部屋はほこりとクモの巣だらけだった。,,0,0
source,"情報源,原因",名詞,The river is the main source of water for the city.,その川は都市の主要な水源だ。,What is the source of this information?,この情報の情報源は何ですか？,He is a reliable source of news.,彼は信頼できるニュースの情報源だ。,The sun is a powerful source of energy.,太陽は強力なエネルギー源だ。,,0,0
awareness,"気づき,認識",名詞,There is a growing awareness of environmental issues.,環境問題に対する意識が高まっている。,He has a strong awareness of his surroundings.,彼は周囲の状況に対する強い認識を持っている。,The campaign aims to raise public awareness about the disease.,そのキャンペーンは病気に対する一般の認識を高めることを目的としている。,Self-awareness is important for personal growth.,自己認識は個人の成長にとって重要だ。,,0,0
grand,"壮大な,雄大な",形容詞,The Grand Canyon is a magnificent natural wonder.,グランドキャニオンは壮大な自然の驚異だ。,She has grand plans for her future.,彼女は将来のために壮大な計画を持っている。,The hotel has a grand ballroom.,そのホテルには壮大な舞踏室がある。,He made a grand entrance at the party.,彼はパーティーに堂々と登場した。,,0,0
ambulance,"救急車,救援車",名詞,An ambulance arrived quickly at the scene of the accident.,事故現場に救急車がすぐに到着した。,He was taken to the hospital in an ambulance.,彼は救急車で病院に運ばれた。,Call an ambulance immediately!,すぐに救急車を呼んでください！,The sound of an ambulance siren filled the air.,救急車のサイレンの音が空に響いた。,,0,0
seat,を着席させる/座席,"動詞,名詞",Please take a seat.,どうぞお座りください。,He offered her his seat on the bus.,彼はバスで彼女に席を譲った。,The theater has 500 seats.,その劇場には500席ある。,Can you seat us near the window?,窓際に座らせてもらえますか？,,0,0
affection,"愛情,好意",名詞,She showed great affection for her grandchildren.,彼女は孫たちに深い愛情を示した。,He has a deep affection for classical music.,彼はクラシック音楽に深い愛情を抱いている。,Dogs often show affection by wagging their tails.,犬はしばしば尻尾を振って愛情を示す。,His words were full of warmth and affection.,彼の言葉は温かさと愛情に満ちていた。,,0,0
by heart,"体で覚えて,身体的に覚える",熟語,She learned the poem by heart.,彼女はその詩を暗記した。,He knows all the lyrics to the song by heart.,彼はその歌の歌詞をすべて暗記している。,It's important to learn your multiplication tables by heart.,九九を暗記することは重要だ。,I know the way to her house by heart.,彼女の家への道は暗記している。,,0,0
add to,"付け加える,増やす",熟語,The new features will add to the value of the product.,新しい機能は製品の価値を高めるだろう。,His comments only added to the confusion.,彼のコメントは混乱を増すばかりだった。,The bad weather added to our travel time.,悪天候が私たちの移動時間を増やした。,She added to her collection of stamps.,彼女は切手のコレクションを増やした。,,0,0
craft,"工芸,技能",名詞,She learned the craft of pottery from her grandmother.,彼女は祖母から陶芸の技術を学んだ。,The wooden box was made with great craft and attention to detail.,その木箱は素晴らしい技巧と細部へのこだわりで作られていた。,"He is skilled in various crafts, including woodworking and metalwork.",彼は木工や金属加工など、様々な工芸に長けている。,The small fishing craft sailed out to sea.,小さな漁船が海へ出航した。,,0,0
occupation,"職業,仕事",名詞,What is your current occupation?,現在の職業は何ですか？,His main occupation is writing.,彼の主な仕事は執筆だ。,The building was under military occupation.,その建物は軍事占領下にあった。,She found a new occupation after losing her job.,彼女は仕事を失った後、新しい職を見つけた。,,0,0
typically,"典型的に,一般的に",副詞,He typically arrives at work around 9 AM.,彼は通常、午前9時頃に出勤する。,The weather in this region is typically mild.,この地域の天気は一般的に穏やかだ。,Japanese houses typically have sliding doors.,日本の家屋は典型的に引き戸がある。,A typical day for me typically involves a lot of reading.,私の典型的な一日は、通常多くの読書を伴う。,,0,0
enforcement,"執行,実施",名詞,Law enforcement agencies are investigating the case.,法執行機関がその事件を捜査している。,The new regulations require strict enforcement.,新しい規制は厳格な実施を必要とする。,There was a lack of enforcement of environmental laws.,環境法の執行が不足していた。,The enforcement of traffic rules is crucial for safety.,交通規則の実施は安全にとって極めて重要だ。,,0,0
convince,"を納得させる,説得する",動詞,I tried to convince him to change his mind.,私は彼に考えを変えるよう説得しようとした。,She convinced me that it was a good idea.,彼女はそれが良い考えだと私を納得させた。,He couldn't convince his parents to let him go.,彼は両親に自分を行かせるよう説得できなかった。,The evidence was enough to convince the jury.,その証拠は陪審員を納得させるのに十分だった。,,0,0
reject,"拒絶する,断る",動詞,She rejected his proposal of marriage.,彼女は彼の結婚の申し込みを断った。,The company decided to reject the job applicant.,会社はその求職者を不採用にすることを決定した。,He tends to reject any ideas that are not his own.,彼は自分のものでないアイデアはどんなものでも拒絶する傾向がある。,It is important to learn how to handle rejection gracefully.,拒絶を優雅に処理する方法を学ぶことは重要だ。,,0,0
dependent,"依存している,頼っている",形容詞,The country is heavily dependent on foreign aid.,その国は外国の援助に大きく依存している。,Children are dependent on their parents for food and shelter.,子供たちは食料と住居を親に頼っている。,Our success is dependent on the weather.,私たちの成功は天候に左右される。,He is financially dependent on his wife.,彼は経済的に妻に依存している。,,0,0
share,分かち合う/分け前,"動詞,名詞",It's important to share your toys with your friends.,友達とおもちゃを共有することは大切です。,He received a large share of the profits.,彼は利益の大きな分け前を受け取った。,Can you share your thoughts on this matter?,この件についてあなたの考えを教えていただけますか？,The company's market share has increased this year.,その会社の市場シェアは今年増加しました。,,0,0
controversial,"議論の的になる,論争上の",形容詞,The new law is highly controversial.,その新しい法律は非常に物議を醸している。,He is a controversial figure in the media.,彼はメディアで物議を醸している人物だ。,The decision to build the new road was highly controversial.,新しい道路を建設するという決定は、非常に大きな論争を巻き起こした。,She wrote a controversial article about the government.,彼女は政府に関する物議を醸す記事を書いた。,,0,0
investigator,"捜査官,探偵",名詞,The investigator gathered evidence at the crime scene.,捜査官は犯行現場で証拠を集めた。,A private investigator was hired to solve the case.,その事件を解決するために私立探偵が雇われた。,The lead investigator interviewed all the witnesses.,主任捜査官はすべての目撃者に聞き込みをした。,The investigators are working to determine the cause of the fire.,捜査官たちは火災の原因を特定するために調査している。,,0,0
crucial,"重要な,決定的な",形容詞,It is crucial to get this right.,これを正しく理解することが極めて重要だ。,His support was crucial to the project's success.,彼のサポートはプロジェクトの成功に不可欠だった。,The first few weeks of a new job are crucial.,新しい仕事の最初の数週間は非常に重要だ。,Negotiations have reached a crucial stage.,交渉は決定的な段階に達した。,,0,0
