英語,日本語,品詞,例文英語１,例文日本語１,例文英語2,例文日本語2,例文英語3,例文日本語3,例文英語4,例文日本語4,last_learned_date,mistake_count,correct_count
industry,"産業,工業",名詞,The tourism industry is growing rapidly.,観光産業は急速に成長している。,He works in the automotive industry.,彼は自動車産業で働いている。,The country's economy relies heavily on industry.,その国の経済は産業に大きく依存している。,The software industry is constantly evolving.,ソフトウェア産業は常に進化している。,,0,0
tide,"潮,潮流",名詞,The tide is coming in.,潮が満ちてきている。,We waited for the tide to go out.,私たちは潮が引くのを待った。,The political tide is turning.,政治の流れが変わってきている。,A rising tide lifts all boats.,上げ潮はすべての船を持ち上げる。,,0,0
bid,"入札/入札する,賭ける","名詞,動詞",He made a high bid for the painting.,彼はその絵画に高値をつけた。,The company won the bid for the construction project.,その会社は建設プロジェクトの入札を勝ち取った。,I bid farewell to my friends.,私は友人たちに別れを告げた。,They are preparing a bid for the contract.,彼らは契約のための入札を準備している。,,0,0
be connected to,"に接続する,をつなぐ",熟語,The printer is connected to the computer.,プリンターはコンピューターに接続されている。,This issue is connected to a larger problem.,この問題はより大きな問題と関連している。,Are you connected to the internet?,インターネットに接続されていますか？,The two cities are connected by a new highway.,その2つの都市は新しい高速道路でつながっている。,,0,0
medical,"医学の,医療の",形容詞,He needs urgent medical attention.,彼は緊急の医療処置が必要だ。,She is studying medical science.,彼女は医学を学んでいる。,The hospital provides excellent medical care.,その病院は優れた医療を提供している。,Medical research has made great progress.,医学研究は大きな進歩を遂げた。,,0,0
stable,"安定した,安泰な",形容詞,The patient's condition is stable.,患者の状態は安定している。,He has a stable job.,彼は安定した仕事を持っている。,The economy is becoming more stable.,経済はより安定してきている。,A stable government is essential for peace.,安定した政府は平和に不可欠だ。,,0,0
strange,"奇妙な,異常な",形容詞,That's a strange coincidence.,それは奇妙な偶然だ。,I heard a strange noise.,奇妙な音が聞こえた。,It's strange that he didn't call.,彼が電話してこなかったのは奇妙だ。,She felt a strange sensation.,彼女は奇妙な感覚を覚えた。,,0,0
peacefully,"平和的に,穏やかに",副詞,He slept peacefully.,彼は安らかに眠った。,The two countries resolved the dispute peacefully.,両国は平和的に紛争を解決した。,She lived a long and peacefully life.,彼女は長く穏やかな人生を送った。,The protest ended peacefully.,抗議活動は平和的に終了した。,,0,0
checkup,"健康診断,照合",名詞,I have a dental checkup next week.,来週、歯の検診がある。,It's important to have regular medical checkups.,定期的な健康診断を受けることが重要だ。,The car needs a full checkup.,その車は完全な点検が必要だ。,She went for a routine checkup.,彼女は定期検診に行った。,,0,0
approximately,"約,おおよそ",副詞,The journey takes approximately three hours.,その旅はおよそ3時間かかる。,There were approximately 100 people at the event.,イベントには約100人がいた。,The cost will be approximately $500.,費用はおよそ500ドルになるだろう。,He arrived at approximately 10 o'clock.,彼はおよそ10時に到着した。,,0,0
react,"反応する,返答する",動詞,How did he react to the news?,彼はそのニュースにどう反応しましたか？,Some people react badly to certain foods.,一部の人々は特定の食品に悪く反応する。,The market reacted positively to the announcement.,市場はその発表に好意的に反応した。,Don't react impulsively.,衝動的に反応してはいけない。,,0,0
be pleased with,"を喜ぶ,喜びを感じる",熟語,I'm very pleased with your progress.,あなたの進歩にとても満足している。,She was pleased with the results.,彼女はその結果に喜んだ。,Are you pleased with your new car?,新しい車に満足していますか？,The teacher was pleased with the students' efforts.,先生は生徒たちの努力に満足していた。,,0,0
be known for,"で知られている,有名である",熟語,Paris is known for its beautiful architecture.,パリはその美しい建築で知られている。,He is known for his honesty.,彼は正直さで知られている。,This restaurant is known for its delicious pasta.,このレストランは美味しいパスタで有名だ。,The region is known for its wine production.,その地域はワイン生産で知られている。,,0,0
instead of,"の代わりに,代わって",熟語,Let's go to the park instead of the cinema.,映画館の代わりに公園に行こう。,He chose to walk instead of taking a bus.,彼はバスに乗る代わりに歩くことを選んだ。,Why don't you try talking to him instead of complaining?,文句を言う代わりに、彼と話してみたらどうですか？,She used honey instead of sugar.,彼女は砂糖の代わりに蜂蜜を使った。,,0,0
be familiar with,に馴染みがある,熟語,Are you familiar with this area?,この地域に詳しいですか？,I'm not familiar with his work.,彼の作品には詳しくない。,She is familiar with several programming languages.,彼女はいくつかのプログラミング言語に精通している。,It's good to be familiar with the local customs.,現地の習慣に慣れておくのは良いことだ。,,0,0
whistle,"口笛を吹く,口笛をする",動詞,He whistled a happy tune.,彼は楽しげな曲を口笛で吹いた。,The referee blew his whistle.,審判は笛を吹いた。,I can't whistle.,私は口笛が吹けない。,The train whistled as it approached the station.,列車は駅に近づくと汽笛を鳴らした。,,0,0
strike,"叩く,打つ",動詞,The clock struck twelve.,時計が12時を打った。,Workers went on strike for higher wages.,労働者たちは賃上げを求めてストライキを行った。,The lightning struck the tree.,雷が木に落ちた。,He struck a match to light the candle.,彼はろうそくに火をつけるためにマッチを擦った。,,0,0
observe,"を観察する,を監視する",動詞,Scientists observe the behavior of animals.,科学者は動物の行動を観察する。,Please observe the rules.,規則を守ってください。,He observed that she was nervous.,彼は彼女が緊張していることに気づいた。,We will observe a moment of silence.,私たちは黙祷を捧げる。,,0,0
vocabulary,"単語,語彙",名詞,He has a large vocabulary.,彼は語彙が豊富だ。,Learning new vocabulary is important for language acquisition.,新しい語彙を学ぶことは言語習得にとって重要だ。,The book uses a simple vocabulary.,その本は簡単な語彙を使っている。,Expand your vocabulary by reading more.,もっと読書をして語彙を増やしなさい。,,0,0
illness,"病気,疾患",名詞,She is recovering from a long illness.,彼女は長い病気から回復している。,Stress can cause various illnesses.,ストレスは様々な病気を引き起こす可能性がある。,He took a leave of absence due to illness.,彼は病気のため休職した。,Early diagnosis of illness is crucial.,病気の早期診断は非常に重要だ。,,0,0
run away,逃げ去る,熟語,The dog ran away from home.,犬は家から逃げ出した。,Don't run away from your problems.,問題から逃げてはいけない。,The children ran away from the scary movie.,子供たちは怖い映画から逃げ出した。,He threatened to run away if he didn't get his way.,彼は思い通りにならないと逃げ出すと脅した。,,0,0
react to,"に反応する,受け止める",熟語,How did he react to the news?,彼はそのニュースにどう反応しましたか？,Some people react to pollen with sneezing.,花粉に反応してくしゃみをする人もいる。,The market reacted negatively to the announcement.,市場はその発表に否定的に反応した。,She tends to react to stress by eating.,彼女はストレスに反応して食べる傾向がある。,,0,0
rainforest,熱帯雨林,名詞,The Amazon rainforest is home to many species.,アマゾンの熱帯雨林には多くの種が生息している。,Deforestation is destroying the rainforests.,森林伐採が熱帯雨林を破壊している。,Many unique plants grow in the rainforest.,熱帯雨林には多くの珍しい植物が生育している。,We need to protect the world's rainforests.,私たちは世界の熱帯雨林を保護する必要がある。,,0,0
expect,"予期する,予想する",動詞,I expect him to arrive soon.,彼がすぐに到着するだろうと予想している。,What do you expect from this project?,このプロジェクトに何を期待しますか？,We didn't expect such a large crowd.,こんなに大勢の人が来るとは予想していなかった。,You can't expect to succeed without hard work.,努力なしに成功を期待することはできない。,,0,0
distributor,"卸売業者,問屋",名詞,We are looking for a new distributor in Asia.,アジアで新しい販売代理店を探している。,The company is a leading distributor of electronic components.,その会社は電子部品の大手販売代理店だ。,The film's distributor handled its marketing.,その映画の配給会社がマーケティングを担当した。,They work with a network of distributors worldwide.,彼らは世界中の販売代理店のネットワークと協力している。,,0,0
be considered to,"と見なされる,と認識される",熟語,He is considered to be one of the best doctors.,彼は最高の医者の一人だと見なされている。,The project is considered to be a great success.,そのプロジェクトは大成功だと認識されている。,She is considered to be an expert in her field.,彼女はその分野の専門家だと見なされている。,This area is considered to be safe for tourists.,この地域は観光客にとって安全だと認識されている。,,0,0
in some way,何らかの方法で,熟語,Everyone is talented in some way.,誰もが何らかの方法で才能を持っている。,The new law will affect us all in some way.,新しい法律は何らかの方法で私たち全員に影響を与えるだろう。,I hope I can help you in some way.,何らかの方法であなたを助けられることを願っている。,The events are connected in some way.,それらの出来事は何らかの方法でつながっている。,,0,0
progress,"進歩,前進",名詞,We are making good progress on the project.,プロジェクトは順調に進んでいる。,Technological progress has been rapid.,技術の進歩は急速だった。,He showed great progress in his studies.,彼は学業で大きな進歩を見せた。,The doctor said her condition is showing progress.,医者は彼女の状態が進歩していると言った。,,0,0
sign,"標識,印,合図",名詞,Look for the sign that says 'Exit'.,「出口」と書かれた標識を探しなさい。,He made a sign to me to be quiet.,彼は私に静かにするよう合図した。,Is there any sign of improvement?,改善の兆候はありますか？,Please sign your name here.,ここに署名してください。,,0,0
fee,"料金,手数料",名詞,There is an entrance fee of $10.,入場料は10ドルです。,The lawyer charges a high fee.,その弁護士は高い報酬を請求する。,Did you pay the registration fee?,登録料を支払いましたか？,Some banks charge a fee for ATM withdrawals.,一部の銀行はATMでの引き出しに手数料を請求する。,,0,0
tight,"狭い,締まった",形容詞,The jeans are too tight.,そのジーンズはきつすぎる。,Hold on tight!,しっかりつかまって！,We have a tight schedule.,私たちはきついスケジュールだ。,The knot was tied very tight.,その結び目はとてもきつく結ばれていた。,,0,0
persuade,"を説得する,口説き落とす",動詞,I tried to persuade him to change his mind.,私は彼に考えを変えるよう説得しようとした。,She persuaded me to join the club.,彼女は私を説得してクラブに入会させた。,It's difficult to persuade him once he's made up his mind.,彼がいったん決心すると、説得するのは難しい。,Can you persuade them to agree?,彼らを説得して同意させられますか？,,0,0
gradually,"次第に,だんだんに",副詞,The weather gradually improved.,天気は次第に良くなった。,He gradually became more confident.,彼はだんだん自信を持つようになった。,The pain gradually disappeared.,痛みは徐々に消えていった。,The company is gradually expanding its business.,その会社は徐々に事業を拡大している。,,0,0
except for,を除いては,熟語,Everyone was there except for John.,ジョンを除いて全員がそこにいた。,The store is open every day except for Sunday.,その店は日曜日を除いて毎日開いている。,The house was empty except for a few pieces of furniture.,その家はいくつかの家具を除いて空っぽだった。,I like all fruits except for durian.,ドリアンを除いて、すべての果物が好きだ。,,0,0
rarely,"めったに～ない,稀に",副詞,He rarely goes out on weekends.,彼は週末めったに外出しない。,It rarely snows in this region.,この地域ではめったに雪が降らない。,She rarely complains.,彼女はめったに文句を言わない。,Such opportunities rarely come along.,そのような機会はめったに訪れない。,,0,0
large amount of,"大量の,たくさんの",熟語,He inherited a large amount of money.,彼は多額の遺産を相続した。,A large amount of data was collected.,大量のデータが収集された。,She spends a large amount of time studying.,彼女は勉強に多くの時間を費やしている。,A large amount of effort was put into the project.,そのプロジェクトには多大な努力が注がれた。,,0,0
in tough,"苦労して,厳しい",熟語,The company is in tough competition.,その会社は厳しい競争にさらされている。,He's in a tough situation.,彼は厳しい状況にいる。,It's tough to make a living as an artist.,芸術家として生計を立てるのは厳しい。,They are in tough negotiations.,彼らは厳しい交渉を行っている。,,0,0
sculpture,"彫刻,彫像",名詞,The museum has a beautiful marble sculpture.,その美術館には美しい大理石の彫刻がある。,He is a master of modern sculpture.,彼は現代彫刻の巨匠だ。,The artist created a large outdoor sculpture.,その芸術家は大きな屋外彫刻を制作した。,The park is filled with interesting sculptures.,その公園は興味深い彫刻でいっぱいだ。,,0,0
warm,"暖かい,温暖な",形容詞,The weather is warm today.,今日は暖かい天気だ。,She gave me a warm welcome.,彼女は私を温かく迎えてくれた。,Wear warm clothes in winter.,冬は暖かい服を着なさい。,I like warm milk before bed.,寝る前に温かい牛乳が好きだ。,,0,0
square,"四方形,四角形",名詞,The table is square.,そのテーブルは四角い。,Let's meet in the town square.,町の広場で会おう。,He lives in a house with a small square garden.,彼は小さな四角い庭のある家に住んでいる。,Two squared is four.,2の2乗は4だ。,,0,0
on duty,"勤務時間中で,当番の",熟語,The police officer was on duty.,その警察官は勤務中だった。,Who is on duty tonight?,今夜の当番は誰ですか？,Nurses are on duty 24 hours a day.,看護師は24時間勤務している。,He is not allowed to drink alcohol when he is on duty.,彼は勤務中は飲酒を許されていない。,,0,0
skill,"技能,技術",名詞,He has excellent communication skills.,彼は優れたコミュニケーション能力を持っている。,Learning a new skill takes time and practice.,新しいスキルを習得するには時間と練習が必要だ。,Her skill in painting is remarkable.,彼女の絵の腕前は素晴らしい。,This job requires a high level of skill.,この仕事には高いレベルのスキルが求められる。,,0,0
equally,均等に,副詞,Divide the cake equally among everyone.,ケーキをみんなで均等に分けなさい。,All students are treated equally.,すべての生徒は平等に扱われる。,He is equally talented in music and art.,彼は音楽と芸術の両方で同じくらい才能がある。,It's equally important to listen as to speak.,話すことと同じくらい聞くことも重要だ。,,0,0
feed,"餌を与える,育てる",動詞,Please feed the cat.,猫に餌をあげてください。,She feeds her baby every three hours.,彼女は3時間ごとに赤ちゃんに授乳する。,The river feeds into the lake.,その川は湖に流れ込んでいる。,He feeds his family by working hard.,彼は一生懸命働くことで家族を養っている。,,0,0
on demand,要求に応じて,熟語,The service provides movies on demand.,そのサービスはオンデマンドで映画を提供する。,Information is available on demand.,情報は要求に応じて利用できる。,They offer technical support on demand.,彼らはオンデマンドで技術サポートを提供している。,You can access the content on demand.,オンデマンドでコンテンツにアクセスできます。,,0,0
tragedy,"悲劇,悲惨な出来事",名詞,The accident was a terrible tragedy.,その事故はひどい悲劇だった。,His life was marked by tragedy.,彼の人生は悲劇に彩られていた。,It's a tragedy that so many lives were lost.,多くの命が失われたのは悲劇だ。,The play ended in tragedy.,その劇は悲劇で終わった。,,0,0
carbon dioxide,二酸化炭素,熟語,Plants absorb carbon dioxide from the atmosphere.,植物は大気中の二酸化炭素を吸収する。,Burning fossil fuels releases carbon dioxide.,化石燃料を燃やすと二酸化炭素が放出される。,Carbon dioxide is a greenhouse gas.,二酸化炭素は温室効果ガスだ。,Reducing carbon dioxide emissions is crucial.,二酸化炭素排出量の削減は極めて重要だ。,,0,0
deal,"を扱う,分配する",動詞,How do you deal with stress?,ストレスにどう対処しますか？,It's your turn to deal the cards.,カードを配るのはあなたの番だ。,We made a good deal on the car.,私たちはその車で良い取引をした。,This book deals with the history of Japan.,この本は日本の歴史を扱っている。,,0,0
material,"材料,原料",名詞,What material is this shirt made of?,このシャツは何の素材でできていますか？,He collected material for his research.,彼は研究のための資料を集めた。,The new building uses sustainable materials.,新しい建物は持続可能な材料を使用している。,She has a lot of reading material.,彼女はたくさんの読み物を持っている。,,0,0
in effect,"効果のある,効いている",熟語,The new law is in effect from today.,新しい法律は今日から施行される。,"His words were, in effect, a warning.",彼の言葉は、事実上、警告だった。,The old rules are no longer in effect.,古い規則はもはや有効ではない。,The policy is still in effect.,その政策はまだ有効だ。,,0,0
sphere,"球,球体",名詞,The Earth is a sphere.,地球は球体だ。,His influence extends into the political sphere.,彼の影響力は政治の分野にまで及んでいる。,The crystal ball was a perfect sphere.,その水晶玉は完璧な球体だった。,This problem falls outside my sphere of expertise.,この問題は私の専門分野外だ。,,0,0
effective,"効果的な,有用な",形容詞,This medicine is very effective against the flu.,この薬はインフルエンザに非常に効果的だ。,We need to find a more effective solution.,もっと効果的な解決策を見つける必要がある。,The new marketing strategy was very effective.,新しいマーケティング戦略は非常に効果的だった。,He is an effective leader.,彼は有能なリーダーだ。,,0,0
out of date,"時代遅れの,古風な",熟語,This software is completely out of date.,このソフトウェアは完全に時代遅れだ。,His ideas are a bit out of date.,彼の考えは少し古風だ。,The information in this book is out of date.,この本の情報は時代遅れだ。,Don't use out-of-date methods.,時代遅れの方法を使ってはいけない。,,0,0
substitute,代用品/代わりに用いる,"名詞,動詞",Margarine can be used as a substitute for butter.,マーガリンはバターの代用品として使える。,The teacher had to find a substitute for the absent student.,先生は欠席した生徒の代わりを見つけなければならなかった。,You can substitute sugar with honey in this recipe.,このレシピでは砂糖を蜂蜜で代用できる。,There is no substitute for hard work.,努力に代わるものはない。,,0,0
bravely,"勇敢に,りっぱに",副詞,He bravely faced the challenge.,彼は勇敢にその課題に立ち向かった。,She bravely rescued the child from the fire.,彼女は勇敢に火の中から子供を救出した。,The soldiers fought bravely.,兵士たちは勇敢に戦った。,He bravely admitted his mistake.,彼は勇敢にも自分の間違いを認めた。,,0,0
moderator,"調整者,司会,仲介者",名詞,The moderator kept the discussion fair and balanced.,司会者は議論を公平かつバランスの取れたものに保った。,She acted as a moderator in the debate.,彼女は討論会で仲介者として行動した。,The online forum has several moderators.,そのオンラインフォーラムには複数のモデレーターがいる。,He is a skilled moderator.,彼は熟練した司会者だ。,,0,0
knowledge,"知識,学識",名詞,He has a vast knowledge of history.,彼は歴史に関する幅広い知識を持っている。,Knowledge is power.,知識は力だ。,She shared her knowledge with the students.,彼女は生徒たちと知識を共有した。,Practical knowledge is very important.,実践的な知識は非常に重要だ。,,0,0
welfare,"福祉,幸福",名詞,The government is responsible for the welfare of its citizens.,政府は国民の福祉に責任がある。,Animal welfare is an important issue.,動物福祉は重要な問題だ。,He is concerned about the welfare of his employees.,彼は従業員の幸福を心配している。,The new policies aim to improve public welfare.,新しい政策は公共の福祉を向上させることを目指している。,,0,0
on the run,"逃げて,奔走して",熟語,The suspect is still on the run.,容疑者はまだ逃走中だ。,He's been on the run for weeks.,彼は数週間逃げ回っている。,"She's always on the run, busy with work.",彼女はいつも仕事で忙しく奔走している。,The police are searching for a criminal who is on the run.,警察は逃走中の犯人を捜している。,,0,0
be short of,"が不足する,欠ける",熟語,We are short of time.,私たちは時間が不足している。,The company is short of staff.,その会社は人手不足だ。,I'm a bit short of money this month.,今月は少しお金が足りない。,Don't be short of confidence.,自信をなくしてはいけない。,,0,0
revenge,に復讐する/復讐,"名詞,動詞",He sought revenge for his brother's death.,彼は兄の死の復讐を求めた。,Revenge is a dish best served cold.,復讐は冷めてから出すのが一番だ。,She got her revenge by winning the game.,彼女は試合に勝つことで復讐を果たした。,He swore revenge on his enemies.,彼は敵に復讐を誓った。,,0,0
out of use,"すたれて,使用できない",熟語,The old phone booth is out of use.,その古い電話ボックスは使用できない。,Many traditional crafts are falling out of use.,多くの伝統工芸品が廃れつつある。,The machine has been out of use for months.,その機械は何ヶ月も使用されていない。,This road is out of use due to construction.,この道路は工事のため使用できない。,,0,0
get rid of,"を取り除く,除去する",熟語,I need to get rid of these old clothes.,これらの古い服を処分する必要がある。,It's hard to get rid of bad habits.,悪い習慣を取り除くのは難しい。,How can I get rid of this headache?,この頭痛をどうすれば取り除けますか？,They want to get rid of the old system.,彼らは古いシステムを廃止したいと考えている。,,0,0
gather,"を集める,収集する",動詞,We gathered around the campfire.,私たちはキャンプファイヤーの周りに集まった。,She gathered information for her report.,彼女はレポートのために情報を集めた。,"The clouds are gathering, it might rain.",雲が集まってきている、雨が降るかもしれない。,Let's gather some firewood.,薪を集めよう。,,0,0
