英語,日本語,品詞,例文英語１,例文日本語１,例文英語2,例文日本語2,例文英語3,例文日本語3,例文英語4,例文日本語4,last_learned_date,mistake_count,correct_count
gallop,全力で走る/早い進捗,動詞,The horse began to gallop across the field.,馬は野原を全力で走り始めた。,The economy is growing at a gallop.,経済は急速な勢いで成長している。,He heard the sound of horses galloping in the distance.,彼は遠くで馬が全力で走る音を聞いた。,The project is progressing at a gallop.,プロジェクトは急速に進捗している。,,0,0
within,"以内で,内部で","前置詞,副詞",Please reply within three days.,3日以内に返信してください。,The answer is within your reach.,答えはあなたの手の届く範囲にある。,He found peace within himself.,彼は自分の中に平和を見出した。,The store is located within walking distance.,その店は徒歩圏内にある。,,0,0
emotional,"感情の,情緒の",形容詞,She had an emotional reaction to the news.,彼女はそのニュースに感情的な反応を示した。,It was an emotional moment for everyone.,それは皆にとって感動的な瞬間だった。,He is not very good at expressing his emotional feelings.,彼は感情を表現するのがあまり得意ではない。,The movie was very emotional and made me cry.,その映画はとても感動的で、私を泣かせた。,,0,0
composition,"構成,制作",名詞,The composition of the soil affects plant growth.,土壌の構成は植物の成長に影響を与える。,She studied musical composition at the university.,彼女は大学で作曲を学んだ。,The painting's composition is very balanced.,その絵画の構図は非常にバランスが取れている。,He wrote a short composition for his English class.,彼は英語の授業のために短い作文を書いた。,,0,0
extreme,"極端な,過激な",形容詞,He went to extreme lengths to achieve his goal.,彼は目標達成のために極端な手段を講じた。,The weather conditions were extreme.,気象条件は極端だった。,She has an extreme fear of heights.,彼女は極度の高所恐怖症だ。,We need to avoid extreme solutions.,極端な解決策は避ける必要がある。,,0,0
rational,"理性的な,合理的な",形容詞,Try to be rational and think logically.,理性的になり、論理的に考えなさい。,There's a rational explanation for everything.,すべてのことには合理的な説明がある。,He made a rational decision based on the facts.,彼は事実に基づいて合理的な決定を下した。,Humans are considered rational beings.,人間は理性的な存在だと考えられている。,,0,0
independent,"独立した,自立した",形容詞,She is a strong and independent woman.,彼女は強く自立した女性だ。,The country gained its independence last century.,その国は前世紀に独立を達成した。,He prefers to work as an independent contractor.,彼は独立した請負業者として働くことを好む。,The research was conducted by an independent committee.,その調査は独立した委員会によって行われた。,,0,0
motive,"動機,意欲",名詞,The police are investigating the suspect's motive.,警察は容疑者の動機を捜査している。,What was his motive for committing the crime?,彼がその犯罪を犯した動機は何だったのか？,Her only motive was to help others.,彼女の唯一の動機は他人を助けることだった。,The company's primary motive is profit.,その会社の主な動機は利益だ。,,0,0
energy,"元気,精力",名詞,She has a lot of energy in the morning.,彼女は朝、たくさんの元気がある。,We need to conserve energy.,私たちはエネルギーを節約する必要がある。,Solar energy is a renewable source of power.,太陽エネルギーは再生可能な動力源だ。,He put all his energy into the project.,彼はプロジェクトに全力を注いだ。,,0,0
scheme,"計画,企画",名詞,The government launched a new scheme to help the unemployed.,政府は失業者を支援するための新しい計画を開始した。,He devised a clever scheme to escape.,彼は脱出するための巧妙な計画を考案した。,The color scheme of the room is very pleasing.,その部屋の配色計画はとても心地よい。,The company's pension scheme is very generous.,その会社の年金制度は非常に手厚い。,,0,0
mate,"友達,仲間",名詞,He's my best mate from school.,彼は学校からの親友だ。,The male bird is looking for a mate.,オスの鳥はつがいを探している。,"Let's go, mate!",行こうぜ、相棒！,"The chess player said \checkmate\"".""",チェスのプレイヤーは「チェックメイト」と言った。,,0,0
request,要求する,動詞,I requested a refund for the damaged item.,破損した商品について返金を要求した。,Your request has been processed.,あなたの要求は処理されました。,He made a special request to the manager.,彼はマネージャーに特別な要求をした。,We kindly request your cooperation.,ご協力をお願いいたします。,,0,0
application,"適用,応用",名詞,You need to submit your application by Friday.,金曜日までに申請書を提出する必要があります。,The new technology has many practical applications.,その新技術には多くの実用的な応用がある。,He downloaded a new application for his phone.,彼は携帯電話に新しいアプリケーションをダウンロードした。,The application of this theory is complex.,この理論の適用は複雑だ。,,0,0
labor,"労働,労働者",名詞,Manual labor is physically demanding.,肉体労働は身体的にきつい。,The company is facing a labor shortage.,その会社は労働力不足に直面している。,She went into labor early.,彼女は早く陣痛が始まった。,The project required a lot of hard labor.,そのプロジェクトには多くの骨の折れる労働が必要だった。,,0,0
unable,"できない,不能である",形容詞,I am unable to attend the meeting tomorrow.,明日の会議には出席できません。,She was unable to find her keys.,彼女は鍵を見つけることができなかった。,The system is currently unable to process your request.,システムは現在、あなたのリクエストを処理できません。,He was unable to speak due to a sore throat.,彼は喉の痛みのため話すことができなかった。,,0,0
graduation,卒業,名詞,Her graduation ceremony is next month.,彼女の卒業式は来月だ。,He celebrated his graduation with friends and family.,彼は友人や家族と卒業を祝った。,"After graduation, she plans to travel abroad.",卒業後、彼女は海外旅行を計画している。,Graduation is a significant milestone in a student's life.,卒業は学生の人生における重要な節目だ。,,0,0
extension,"拡張,展開",名詞,I missed the deadline but was granted an extension.,締め切りに間に合いませんでしたが、延長が認められました。,They built an extension on their house.,彼らは家に増築しました。,Please call me on extension 308.,内線308番にお電話ください。,Our web page is an extension of everything we do.,私たちのウェブページは、私たちのすべての活動の延長です。,,0,0
inflation,"膨張,拡大",名詞,The country is experiencing high inflation.,その国は高いインフレを経験している。,Inflation erodes the purchasing power of money.,インフレは貨幣の購買力を低下させる。,The central bank is trying to control inflation.,中央銀行はインフレを抑制しようとしている。,The inflation of the balloon made it float.,風船の膨張により、それは浮いた。,,0,0
telescope,"望遠鏡,遠望鏡",名詞,He used a telescope to observe the stars.,彼は望遠鏡を使って星を観察した。,The new space telescope will provide amazing images.,新しい宇宙望遠鏡は素晴らしい画像を提供するだろう。,Galileo was one of the first to use a telescope for astronomy.,ガリレオは天文学に望遠鏡を最初に使った一人だ。,You can see the moon clearly through a powerful telescope.,強力な望遠鏡を使えば月がはっきりと見える。,,0,0
guilty,"有罪の,罪のある",形容詞,The jury found him guilty of the crime.,陪審員は彼がその罪で有罪であると判断した。,She felt guilty for forgetting her friend's birthday.,彼女は友人の誕生日を忘れたことに罪悪感を感じた。,He pleaded not guilty to all charges.,彼はすべての容疑に対して無罪を主張した。,I have a guilty pleasure of eating chocolate late at night.,夜遅くにチョコレートを食べるのが私の密かな楽しみだ。,,0,0
neighborhood,"近所,近隣",名詞,Our neighborhood is very friendly.,私たちの近所はとても友好的だ。,There's a new coffee shop in the neighborhood.,近所に新しいコーヒーショップができた。,The crime rate in this neighborhood is low.,この近所の犯罪率は低い。,She grew up in a quiet neighborhood.,彼女は静かな近所で育った。,,0,0
reward,"褒美,報酬",名詞,He received a reward for finding the lost dog.,彼は迷子になった犬を見つけた褒美を受け取った。,Hard work will eventually bring its own reward.,努力は最終的にそれ自身の報酬をもたらすだろう。,The company offers a generous reward for good performance.,その会社は良い業績に対して寛大な報酬を提供している。,The joy of learning is its own reward.,学ぶ喜びはそれ自体が報酬である。,,0,0
perception,"知覚,認知",名詞,His perception of reality is distorted.,彼の現実認識は歪んでいる。,The public's perception of the company has improved.,その会社に対する世間の認識は改善された。,Visual perception is a complex process.,視覚的知覚は複雑なプロセスだ。,She has a keen perception of human nature.,彼女は人間性に対する鋭い洞察力を持っている。,,0,0
affair,"事柄,問題",名詞,"It's a private affair, so please don't interfere.",それは個人的な事柄なので、干渉しないでください。,The scandal became a public affair.,そのスキャンダルは公の問題となった。,He had an affair with his colleague.,彼は同僚と不倫関係にあった。,The conference dealt with international affairs.,その会議では国際問題が扱われた。,,0,0
stroke,"打撃,衝撃",名詞,He suffered a stroke and lost the ability to speak.,彼は脳卒中を起こし、話す能力を失った。,"With a single stroke of the brush, she created a masterpiece.",彼女は一筆で傑作を生み出した。,The swimmer changed his stroke.,その水泳選手は泳ぎ方を変えた。,He gave the cat a gentle stroke.,彼は猫を優しくなでた。,,0,0
originate,"始まる,起こす",動詞,The custom originated in ancient times.,その習慣は古代に始まった。,Where did this idea originate from?,このアイデアはどこから生まれたのか？,The fire originated in the kitchen.,火事は台所から発生した。,Many rivers originate in the mountains.,多くの川は山に源を発する。,,0,0
tiny,"ごく小さい,微小な",形容詞,The baby has tiny hands and feet.,その赤ちゃんは小さな手足をしている。,We live in a tiny apartment in the city.,私たちは市内の小さなアパートに住んでいる。,A tiny mistake can lead to big problems.,小さな間違いが大きな問題につながることがある。,She found a tiny spider in her shoe.,彼女は靴の中に小さなクモを見つけた。,,0,0
soon after,"の直後に,まもなく",熟語,He arrived soon after I did.,私が到着した直後に彼が来た。,The accident happened soon after takeoff.,離陸直後に事故が起こった。,She fell asleep soon after lying down.,彼女は横になってまもなく眠りに落ちた。,The new store opened soon after the holidays.,新しい店は休日の直後にオープンした。,,0,0
essentially,"本質的に,根本的に",副詞,He is essentially a good person.,彼は本質的に良い人だ。,The two proposals are essentially the same.,2つの提案は本質的に同じだ。,"Essentially, we need to cut costs.",根本的に、私たちはコストを削減する必要がある。,The problem is essentially a lack of communication.,問題は本質的にコミュニケーション不足だ。,,0,0
historical,"歴史上の,過去の",形容詞,The city has many historical buildings.,その都市には多くの歴史的建造物がある。,He is a historical novelist.,彼は歴史小説家だ。,The event has great historical significance.,その出来事は歴史的に大きな意味を持つ。,We visited a historical museum to learn about the past.,過去について学ぶために歴史博物館を訪れた。,,0,0
plain,"簡素な,わかりやすい",形容詞,She prefers plain clothes to fancy ones.,彼女は派手な服よりも簡素な服を好む。,The instructions were written in plain English.,指示は平易な英語で書かれていた。,It's plain to see that he's upset.,彼が動揺しているのは明らかだ。,The vast plain stretched as far as the eye could see.,広大な平野が目の届く限り広がっていた。,,0,0
elaborate,"手の込んだ,複雑な",形容詞,She wore an elaborate gown to the ball.,彼女は舞踏会に手の込んだガウンを着ていた。,Can you elaborate on your proposal?,あなたの提案について詳しく説明してもらえますか？,The plan was too elaborate to be practical.,その計画は複雑すぎて実用的ではなかった。,He spent hours elaborating on his theory.,彼は自分の理論を詳しく説明するのに何時間も費やした。,,0,0
advocate,"提唱する,主張する",動詞,She is a strong advocate for human rights.,彼女は人権の強力な擁護者だ。,He advocates for stricter environmental laws.,彼はより厳しい環境法を提唱している。,The organization advocates for children's welfare.,その組織は児童福祉を擁護している。,"As a lawyer, he advocates for his clients in court.",弁護士として、彼は法廷で依頼人のために弁護する。,,0,0
educational,"教育の,教授の",形容詞,The museum offers many educational programs for children.,その博物館は子供向けの教育プログラムを多数提供している。,She has a strong educational background in science.,彼女は科学において確かな教育的背景を持っている。,This documentary is very educational.,このドキュメンタリーは非常に教育的だ。,Educational reforms are necessary for the country's future.,国の未来のために教育改革が必要だ。,,0,0
household,"家族,世帯",名詞,The average household income has increased.,平均世帯収入が増加した。,She is responsible for all the household chores.,彼女はすべての家事を担当している。,Many households now have access to high-speed internet.,多くの世帯が高速インターネットにアクセスできるようになった。,This product is a common household item.,この製品は一般的な家庭用品だ。,,0,0
apparent,"外見上の,明白な",形容詞,It was apparent that he was lying.,彼が嘘をついているのは明らかだった。,The apparent cause of death was a heart attack.,明白な死因は心臓発作だった。,Her joy was apparent to everyone.,彼女の喜びは誰の目にも明らかだった。,There was no apparent reason for his sudden departure.,彼が突然出発した明白な理由はなかった。,,0,0
incorporate,"合体させる,統合する",動詞,We will incorporate your suggestions into the plan.,あなたの提案を計画に組み込む。,The company decided to incorporate in Delaware.,その会社はデラウェア州で法人化することを決定した。,The new design incorporates elements of traditional architecture.,新しいデザインは伝統的な建築の要素を取り入れている。,It's important to incorporate feedback into your work.,フィードバックを自分の仕事に取り入れることが重要だ。,,0,0
similarity,"類似点,相似",名詞,There is a striking similarity between the two cases.,2つのケースには驚くべき類似点がある。,We found a strong similarity in their handwriting.,彼らの筆跡に強い類似性を見つけた。,"Despite their differences, there is a fundamental similarity in their goals.",違いはあるものの、彼らの目標には根本的な類似性がある。,The similarity in their voices was remarkable.,彼らの声の類似性は驚くべきものだった。,,0,0
consequently,"その結果として,それゆえに",副詞,"He worked hard, and consequently, he got a promotion.",彼は熱心に働き、その結果、昇進した。,"The road was icy; consequently, many accidents occurred.",道は凍結していた。それゆえに、多くの事故が発生した。,She missed the bus and consequently arrived late for work.,彼女はバスに乗り遅れ、その結果、仕事に遅刻した。,"The company reduced its prices; consequently, sales increased.",その会社は価格を下げた。その結果、売上が増加した。,,0,0
colleague,"同僚,仲間",名詞,He is a respected colleague.,彼は尊敬されている同僚だ。,I discussed the problem with my colleagues.,同僚たちとその問題について話し合った。,She is a new colleague in our department.,彼女は私たちの部署の新しい同僚だ。,My colleague helped me with the presentation.,同僚がプレゼンテーションを手伝ってくれた。,,0,0
contribute,"に寄付する,捧げる",動詞,Everyone should contribute to the community.,誰もが地域社会に貢献すべきだ。,He contributed an article to the magazine.,彼は雑誌に記事を寄稿した。,Stress can contribute to various health problems.,ストレスは様々な健康問題の一因となることがある。,We encourage employees to contribute their ideas.,従業員にはアイデアを貢献するよう奨励している。,,0,0
party,"政党,党派",名詞,We are having a party on Saturday.,土曜日にパーティーを開く。,Which political party do you support?,どの政党を支持していますか？,He was the life of the party.,彼はパーティーの盛り上げ役だった。,The search party found the missing hiker.,捜索隊は行方不明のハイカーを発見した。,,0,0
potentially,"潜在的に,可能性として",副詞,This new drug is potentially very effective.,この新薬は潜在的に非常に効果的だ。,The situation is potentially dangerous.,その状況は潜在的に危険だ。,He is potentially the best player on the team.,彼はチームで潜在的に最高の選手だ。,The company is exploring potentially new markets.,その会社は潜在的に新しい市場を探っている。,,0,0
criticize,"を批評する,を評価する",動詞,"It's easy to criticize others, but harder to offer solutions.",他人を批判するのは簡単だが、解決策を提示するのは難しい。,The media criticized the government's decision.,メディアは政府の決定を批判した。,Don't criticize him for his mistakes; help him learn.,彼の過ちを批判するのではなく、彼が学ぶのを助けなさい。,She tends to criticize herself too harshly.,彼女は自分自身を厳しく批判しがちだ。,,0,0
lab,"研究室,研究所",名詞,The scientists are working in the lab.,科学者たちは研究室で働いている。,We conducted an experiment in the chemistry lab.,化学実験室で実験を行った。,The company has a state-of-the-art research lab.,その会社は最先端の研究施設を持っている。,He spent all night in the computer lab.,彼は一晩中コンピューター室にいた。,,0,0
hang,"つるす,掛ける",動詞,Please hang your coat on the hook.,コートをフックに掛けてください。,The picture was hanging crookedly on the wall.,その絵は壁に斜めに掛かっていた。,Let's hang out at the park this afternoon.,今日の午後、公園でぶらぶらしよう。,He decided to hang up his boxing gloves.,彼はボクシンググローブを引退することにした。,,0,0
colony,"植民地,入植地",名詞,Australia was once a British colony.,オーストラリアはかつてイギリスの植民地だった。,A colony of ants marched across the kitchen floor.,アリのコロニーがキッチンの床を行進していた。,The first European settlers established a colony in North America.,最初のヨーロッパ人入植者たちは北米に植民地を築いた。,There is a large artist colony in that town.,その町には大きな芸術家村がある。,,0,0
shed,"流す,排出する",動詞,The dog sheds a lot of hair in the spring.,その犬は春にたくさんの毛を流す。,She shed a few tears during the emotional movie.,彼女は感動的な映画の間、少し涙を流した。,The tree sheds its leaves in autumn.,その木は秋に葉を落とす。,He built a small shed in the garden for his tools.,彼は道具のために庭に小さな物置小屋を建てた。,,0,0
unidentified,"未知の,特定されていない",形容詞,An unidentified flying object was seen in the sky.,空に未確認飛行物体が目撃された。,The police are searching for an unidentified suspect.,警察は身元不明の容疑者を捜索している。,The cause of the explosion is still unidentified.,爆発の原因はまだ特定されていない。,They found an unidentified substance at the crime scene.,彼らは犯罪現場で未確認の物質を発見した。,,0,0
own,"自身の,自分自身の",形容詞,I want to buy my own house someday.,いつか自分の家を買いたい。,She has her own unique style.,彼女は自分自身のユニークなスタイルを持っている。,He owns a small business.,彼は小さなビジネスを所有している。,You should make your own decisions.,あなたは自分で決断すべきだ。,,0,0
origin,"起源,由来",名詞,The origin of the universe is a complex topic.,宇宙の起源は複雑なテーマだ。,We are trying to trace the origin of the problem.,私たちは問題の起源をたどろうとしている。,"The word \robot\"" has Czech origin.""",「ロボット」という言葉はチェコ語に由来する。,Her family is of Japanese origin.,彼女の家族は日本出身だ。,,0,0
reputation,"評判,評価",名詞,The company has a good reputation for quality products.,その会社は高品質な製品で良い評判を得ている。,His reputation as a reliable person is well-known.,信頼できる人物としての彼の評判はよく知られている。,It took years to build her reputation as an expert.,彼女が専門家としての評判を築くには何年もかかった。,A single mistake can damage your reputation.,一つの間違いがあなたの評判を傷つけることがある。,,0,0
plot,"話の筋,物語の筋",名詞,The plot of the movie was very complex.,その映画の筋は非常に複雑だった。,They are plotting against the government.,彼らは政府に対して陰謀を企てている。,He bought a small plot of land to build a house.,彼は家を建てるために小さな土地を購入した。,The gardener planted vegetables in his plot.,庭師は自分の区画に野菜を植えた。,,0,0
state,"状態,状況",名詞,The patient is in a stable state.,患者は安定した状態にある。,Please state your name and address.,氏名と住所を述べてください。,The United States is composed of 50 states.,アメリカ合衆国は50の州で構成されている。,He was in a state of shock after the accident.,彼は事故の後、ショック状態だった。,,0,0
beneath,"の下に,以下に",前置詞,The treasure was buried beneath the old oak tree.,宝物は古い樫の木の下に埋められていた。,He felt a strange sensation beneath his feet.,彼は足元に奇妙な感覚を覚えた。,The submarine traveled beneath the surface of the ocean.,潜水艦は海の表面の下を進んだ。,He considered himself beneath such tasks.,彼はそのような仕事は自分にはふさわしくないと考えた。,,0,0
ray,"光線,放射線",名詞,A ray of sunshine broke through the clouds.,一筋の太陽の光が雲間から差し込んだ。,The doctor used X-rays to examine the bone.,医者は骨を調べるためにX線を使った。,There's a ray of hope for the patient.,患者には一縷の望みがある。,The lighthouse sent out a powerful ray of light.,灯台は強力な光線を放った。,,0,0
former,"前の,以前の",形容詞,The former president gave a speech.,前大統領が演説を行った。,He is a former student of this university.,彼はこの大学の元学生だ。,"In former times, people used horses for transportation.",昔は、人々は移動に馬を使っていた。,The former building was demolished last year.,以前の建物は昨年取り壊された。,,0,0
